{
  "schema": "aether.cloudlink.envelope",
  "protocol": "aether.cloudlink",
  "message_kind": "data-loss",
  "gateway_id": "33333333-3333-4333-8333-333333333333",
  "session_id": "44444444-4444-4444-8444-444444444444",
  "session_epoch": "7",
  "credential_generation": "3",
  "sent_at_ms": "1721000000200",
  "delivery": {
    "stream_id": "loss-evidence",
    "stream_epoch": "1",
    "position": "1",
    "batch_id": "loss-telemetry-2-1-3",
    "digest": "sha256:84102d14efe6b847a9cf211111b3e177eefd3e5925be3930fc51f8b4345c3b79"
  },
  "payload": {
    "stream_id": "telemetry",
    "stream_epoch": "2",
    "first_lost_position": "1",
    "last_lost_position": "3",
    "earliest_retained_position": "4",
    "reason": "capacity-overflow",
    "recorded_at_ms": "1721000000123"
  }
}
